[
  {
    "source_id": "wiki-22-en",
    "tier": 2,
    "title": "2024 South Korean legislative election (English Wikipedia)",
    "url": "https://en.wikipedia.org/wiki/2024_South_Korean_legislative_election",
    "retrieved_at": "2026-04-23",
    "credibility_weight": "medium",
    "known_bias": "English Wikipedia — editorial synthesis of multiple news and academic sources; internal citations not independently verified",
    "captured_to": "data/raw/wiki/na-2024-22-en-wikipedia.md",
    "used_in": ["na-2024-22"],
    "notes": "First-pass election-wide reference. Emphasizes green-onion incident and assassination attempt on Lee Jae-myung."
  },
  {
    "source_id": "wiki-22-ko",
    "tier": 2,
    "title": "대한민국 제22대 국회의원 선거 (Korean Wikipedia)",
    "url": "https://ko.wikipedia.org/wiki/%EB%8C%80%ED%95%9C%EB%AF%BC%EA%B5%AD_%EC%A0%9C22%EB%8C%80_%EA%B5%AD%ED%9A%8C%EC%9D%98%EC%9B%90_%EC%84%A0%EA%B1%B0",
    "retrieved_at": "2026-04-23",
    "credibility_weight": "medium",
    "known_bias": "Korean Wikipedia — editorial synthesis; not strongly partisan-aligned. Different emphasis than English coverage (names specific controversies; underweights single-incident narrative).",
    "captured_to": "data/raw/wiki/na-2024-22-ko-wikipedia.md",
    "used_in": ["na-2024-22"],
    "notes": "Bias-pair companion to wiki-22-en. Names Chae Sang-byeol, Kim Keon-hee, Itaewon, 2023 Jamboree, Busan Expo controversies specifically. Flags record advance turnout (31.28%) and 2023 Gangseo-gu by-election as harbinger."
  },
  {
    "source_id": "wiki-21-ko",
    "tier": 2,
    "title": "대한민국 제21대 국회의원 선거 서울특별시 (Korean Wikipedia)",
    "url": "https://ko.wikipedia.org/wiki/%EB%8C%80%ED%95%9C%EB%AF%BC%EA%B5%AD_%EC%A0%9C21%EB%8C%80_%EA%B5%AD%ED%9A%8C%EC%9D%98%EC%9B%90_%EC%84%A0%EA%B1%B0_%EC%84%9C%EC%9A%B8%ED%8A%B9%EB%B3%84%EC%8B%9C",
    "retrieved_at": "2026-04-23",
    "credibility_weight": "medium",
    "known_bias": "Korean Wikipedia Seoul subpage — editorial synthesis; per-constituency table of winners, runners-up, vote shares.",
    "captured_to": "data/raw/wiki/na-2020-21-ko-wikipedia-seoul.md",
    "used_in": ["na-2020-21"],
    "notes": "Source of truth for 2020 Seoul per-constituency winners + vote shares. Per-district turnout not included in source."
  },
  {
    "source_id": "wiki-jongno-na",
    "tier": 2,
    "title": "종로구의 국회의원 (Korean Wikipedia)",
    "url": "https://ko.wikipedia.org/wiki/%EC%A2%85%EB%A1%9C%EA%B5%AC%EC%9D%98_%EA%B5%AD%ED%9A%8C%EC%9D%98%EC%9B%90",
    "retrieved_at": "2026-04-23",
    "credibility_weight": "medium",
    "known_bias": "Korean Wikipedia constituency page — editorial consensus. '정치 1번지' label is widespread in Korean political discourse.",
    "captured_to": "data/raw/wiki/seoul-districts-2024.md",
    "used_in": ["na-2024-22"],
    "notes": "Jongno identified as bellwether, '정치 1번지'. Notes Gwak Sang-eon 2024 as Roh Moo-hyun's son-in-law. No demographic analysis in source."
  },
  {
    "source_id": "wiki-gangnam-gap-na",
    "tier": 2,
    "title": "강남구 갑 (Korean Wikipedia)",
    "url": "https://ko.wikipedia.org/wiki/%EA%B0%95%EB%82%A8%EA%B5%AC_%EA%B0%91",
    "retrieved_at": "2026-04-23",
    "credibility_weight": "medium",
    "known_bias": "Korean Wikipedia constituency page; focuses on winner succession and boundary changes, not voter analysis.",
    "captured_to": "data/raw/wiki/seoul-districts-2024.md",
    "used_in": ["na-2024-22"],
    "notes": "Consistent PPP stronghold since 2000. 2024: 서명옥 64.18%. Geography: neighborhoods 신사, 논현, 압구정, 청담, 역삼."
  },
  {
    "source_id": "wiki-yongsan-na",
    "tier": 2,
    "title": "용산구 (1988년 선거구) (Korean Wikipedia)",
    "url": "https://ko.wikipedia.org/wiki/%EC%9A%A9%EC%82%B0%EA%B5%AC_(1988%EB%85%84_%EC%84%A0%EA%B1%B0%EA%B5%AC)",
    "retrieved_at": "2026-04-23",
    "credibility_weight": "medium",
    "known_bias": "Korean Wikipedia constituency page; detailed margin history. Does not discuss 2022 presidential office relocation.",
    "captured_to": "data/raw/wiki/seoul-districts-2024.md",
    "used_in": ["na-2024-22"],
    "notes": "Genuine swing district: 2000 margin 0.12pp, 2020 margin 0.66pp, historically flips between parties. 권영세 is recent PPP incumbent."
  },
  {
    "source_id": "wiki-mapo-gap-na",
    "tier": 2,
    "title": "마포구 갑 (Korean Wikipedia)",
    "url": "https://ko.wikipedia.org/wiki/%EB%A7%88%ED%8F%AC%EA%B5%AC_%EA%B0%91",
    "retrieved_at": "2026-04-23",
    "credibility_weight": "medium",
    "known_bias": "Korean Wikipedia constituency page; no voter-analysis content.",
    "captured_to": "data/raw/wiki/seoul-districts-2024.md",
    "used_in": ["na-2024-22"],
    "notes": "2024 flipped PPP at 0.6pp margin after 20-year DPK streak. 조정훈 path: Transition Korea Party then PPP. Structural significance of flip unclear given tiny margin."
  },
  {
    "source_id": "wiki-dongjak-eul-na",
    "tier": 2,
    "title": "동작구 을 (Korean Wikipedia)",
    "url": "https://ko.wikipedia.org/wiki/%EB%8F%99%EC%9E%91%EA%B5%AC_%EC%9D%84",
    "retrieved_at": "2026-04-23",
    "credibility_weight": "medium",
    "known_bias": "Korean Wikipedia constituency page; detailed Na Kyung-won record across 4 elections.",
    "captured_to": "data/raw/wiki/seoul-districts-2024.md",
    "used_in": ["na-2024-22"],
    "notes": "10+ point rightward swing 2020→2024 (45.04% → 54.01% for 나경원). Na Kyung-won is a top-tier national PPP figure. District 상도1, 흑석, 사당1-5동."
  },
  {
    "source_id": "wiki-poll-22",
    "tier": 2,
    "title": "Opinion polling for the 2024 South Korean legislative election (English Wikipedia)",
    "url": "https://en.wikipedia.org/wiki/Opinion_polling_for_the_2024_South_Korean_legislative_election",
    "retrieved_at": "2026-04-25",
    "credibility_weight": "high",
    "known_bias": "English Wikipedia compilation of polling data from multiple Korean polling firms (Korea Research, Research View, MBC, Korea Gallup, Realmeter, etc.); reflects published numbers not editorial synthesis.",
    "captured_to": "data/raw/wiki/na-2024-22-polling-en-wikipedia.md",
    "used_in": ["na-2024-22"],
    "notes": "Source of truth for vote-intention polling Jan-Apr 2024. DPK lead narrowed from 12pp to 6.58pp over the campaign. Does not include executive approval polling."
  },
  {
    "source_id": "wiki-yoon-en",
    "tier": 2,
    "title": "Yoon Suk Yeol (English Wikipedia)",
    "url": "https://en.wikipedia.org/wiki/Yoon_Suk_Yeol",
    "retrieved_at": "2026-04-25",
    "credibility_weight": "medium",
    "known_bias": "Biographical Wikipedia article; covers approval data unevenly with notable gaps for Itaewon, doctor strike, and 2024 campaign-period polling.",
    "captured_to": "data/raw/wiki/yoon-suk-yeol-en-wikipedia.md",
    "used_in": ["na-2024-22"],
    "notes": "Limited quantitative approval data: Aug 2022 (24%), Sept 2022 (27.7%). Confirms qualitative low-approval pattern but lacks comprehensive Korea Gallup / Realmeter timeline."
  },
  {
    "source_id": "wiki-itaewon-en",
    "tier": 2,
    "title": "Seoul Halloween crowd crush (English Wikipedia)",
    "url": "https://en.wikipedia.org/wiki/Seoul_Halloween_crowd_crush",
    "retrieved_at": "2026-04-25",
    "credibility_weight": "high",
    "known_bias": "Detailed factual reconstruction with multiple Korean and international source citations; relatively neutral tone.",
    "captured_to": "data/raw/wiki/itaewon-en-wikipedia.md",
    "used_in": ["na-2024-22"],
    "notes": "159 deaths; Nov 2022 poll showed 7 of 10 Koreans held government responsible. 23 officers charged. Used for the scandal-chain article."
  },
  {
    "source_id": "wiki-chae-en",
    "tier": 2,
    "title": "Death of Chae Su-geun (English Wikipedia)",
    "url": "https://en.wikipedia.org/wiki/Death_of_Chae_Su-geun",
    "retrieved_at": "2026-04-25",
    "credibility_weight": "medium",
    "known_bias": "English Wikipedia summary of the 채상병 (Corporal Chae) investigation-pressure controversy; some details thin.",
    "captured_to": "data/raw/wiki/chae-en-wikipedia.md",
    "used_in": ["na-2024-22"],
    "notes": "2023-07-19 Marine death during flood rescue; Defense Minister halted handover to police. Lee Jong-sup resigned ambassadorship within weeks of March 2024 appointment."
  },
  {
    "source_id": "wiki-cho-kuk-party-en",
    "tier": 2,
    "title": "Rebuilding Korea Party (English Wikipedia)",
    "url": "https://en.wikipedia.org/wiki/Rebuilding_Korea_Party",
    "retrieved_at": "2026-04-25",
    "credibility_weight": "medium",
    "known_bias": "Standard party-page coverage; founder Cho Kuk's legal context covered factually.",
    "captured_to": "data/raw/wiki/cho-kuk-party-en-wikipedia.md",
    "used_in": ["na-2024-22"],
    "notes": "Founded 2024-03-03; 24.25% PR vote (6.87M votes), 12 PR seats, 0 constituency candidates by design. Used for opposition_unity and party_fragmentation articles."
  },
  {
    "source_id": "wiki-lee-jun-seok-en",
    "tier": 2,
    "title": "Lee Jun-seok (English Wikipedia)",
    "url": "https://en.wikipedia.org/wiki/Lee_Jun-seok",
    "retrieved_at": "2026-04-25",
    "credibility_weight": "medium",
    "known_bias": "Biographical page; covers PPP suspension and Reform Party founding factually.",
    "captured_to": "data/raw/wiki/lee-jun-seok-en-wikipedia.md",
    "used_in": ["na-2024-22"],
    "notes": "Founded Reform Party 2024-01-20 after Dec 2023 PPP departure. Won Hwaseong B with 42.41% (51,856 votes). *Idaenam* young-male voter base. Used for party_fragmentation."
  }
]
